[
  {
    "contract_id": "rc_patent_001",
    "version": "v1.0",
    "domain": "patent_writing",
    "required_slots": [
      "facts",
      "procedure-steps",
      "parameter-ranges",
      "risks",
      "citations",
      "disagreements"
    ],
    "slot_constraints": {
      "facts": {
        "required": true,
        "min_coverage_ratio": 1.0,
        "min_items": 3,
        "note": "必须覆盖关键技术事实"
      },
      "procedure-steps": {
        "required": true,
        "min_coverage_ratio": 0.9,
        "min_items": 5
      },
      "parameter-ranges": {
        "required": true,
        "min_coverage_ratio": 0.8,
        "min_items": 2
      },
      "risks": {
        "required": true,
        "min_coverage_ratio": 0.7,
        "min_items": 1
      },
      "citations": {
        "required": true,
        "min_coverage_ratio": 1.0,
        "min_items": 2
      },
      "disagreements": {
        "required": true,
        "min_coverage_ratio": 1.0,
        "min_items": 1
      }
    },
    "source_weights": {
      "verification_agent": 1.4,
      "search_agent": 1.2,
      "writer_agent": 1.0
    },
    "topic_policy": {
      "allowlist": [
        "专利",
        "权利要求",
        "实施例",
        "参数"
      ],
      "blocklist": [
        "闲聊",
        "寒暄"
      ]
    },
    "length_constraints": {
      "global_token_budget": 4000,
      "per_cluster_min_tokens": 120,
      "per_cluster_max_tokens": 520
    },
    "validation_policy": {
      "max_rewrite_rounds": 3,
      "require_entailment_check": true,
      "require_conflict_check": true
    }
  },
  {
    "contract_id": "rc_research_001",
    "version": "v1.0",
    "domain": "research_assistant",
    "required_slots": [
      "facts",
      "rationale",
      "tool-results",
      "citations"
    ],
    "slot_constraints": {
      "facts": {
        "required": true,
        "min_coverage_ratio": 0.9,
        "min_items": 3
      },
      "rationale": {
        "required": true,
        "min_coverage_ratio": 0.8,
        "min_items": 2
      },
      "tool-results": {
        "required": true,
        "min_coverage_ratio": 0.7,
        "min_items": 2
      },
      "citations": {
        "required": true,
        "min_coverage_ratio": 0.9,
        "min_items": 2
      }
    },
    "source_weights": {
      "search_agent": 1.3,
      "analysis_agent": 1.1
    },
    "topic_policy": {
      "allowlist": [
        "论文",
        "实验",
        "结论"
      ],
      "blocklist": [
        "广告"
      ]
    },
    "length_constraints": {
      "global_token_budget": 3200,
      "per_cluster_min_tokens": 80,
      "per_cluster_max_tokens": 420
    },
    "validation_policy": {
      "max_rewrite_rounds": 3,
      "require_entailment_check": true,
      "require_conflict_check": true
    }
  },
  {
    "contract_id": "rc_customer_001",
    "version": "v1.0",
    "domain": "customer_service",
    "required_slots": [
      "facts",
      "decisions",
      "todos",
      "tool-results"
    ],
    "slot_constraints": {
      "facts": {
        "required": true,
        "min_coverage_ratio": 0.8,
        "min_items": 2
      },
      "decisions": {
        "required": true,
        "min_coverage_ratio": 0.8,
        "min_items": 1
      },
      "todos": {
        "required": true,
        "min_coverage_ratio": 0.7,
        "min_items": 1
      },
      "tool-results": {
        "required": false,
        "min_coverage_ratio": 0.5,
        "min_items": 1
      }
    },
    "source_weights": {
      "service_agent": 1.2,
      "policy_agent": 1.1
    },
    "topic_policy": {
      "allowlist": [
        "工单",
        "SLA",
        "处理结果"
      ],
      "blocklist": [
        "无关闲聊"
      ]
    },
    "length_constraints": {
      "global_token_budget": 2200,
      "per_cluster_min_tokens": 64,
      "per_cluster_max_tokens": 280
    },
    "validation_policy": {
      "max_rewrite_rounds": 2,
      "require_entailment_check": true,
      "require_conflict_check": true
    }
  },
  {
    "contract_id": "rc_pm_001",
    "version": "v1.0",
    "domain": "project_management",
    "required_slots": [
      "decisions",
      "todos",
      "risks",
      "procedure-steps"
    ],
    "slot_constraints": {
      "decisions": {
        "required": true,
        "min_coverage_ratio": 1.0,
        "min_items": 2
      },
      "todos": {
        "required": true,
        "min_coverage_ratio": 0.9,
        "min_items": 3
      },
      "risks": {
        "required": true,
        "min_coverage_ratio": 0.8,
        "min_items": 1
      },
      "procedure-steps": {
        "required": true,
        "min_coverage_ratio": 0.8,
        "min_items": 3
      }
    },
    "source_weights": {
      "pm_agent": 1.3,
      "executor_agent": 1.0
    },
    "topic_policy": {
      "allowlist": [
        "里程碑",
        "任务",
        "风险"
      ],
      "blocklist": [
        "八卦"
      ]
    },
    "length_constraints": {
      "global_token_budget": 2600,
      "per_cluster_min_tokens": 80,
      "per_cluster_max_tokens": 360
    },
    "validation_policy": {
      "max_rewrite_rounds": 3,
      "require_entailment_check": true,
      "require_conflict_check": true
    }
  },
  {
    "contract_id": "rc_kb_001",
    "version": "v1.0",
    "domain": "knowledge_base",
    "required_slots": [
      "facts",
      "citations",
      "tool-results",
      "parameter-ranges"
    ],
    "slot_constraints": {
      "facts": {
        "required": true,
        "min_coverage_ratio": 0.9,
        "min_items": 3
      },
      "citations": {
        "required": true,
        "min_coverage_ratio": 1.0,
        "min_items": 2
      },
      "tool-results": {
        "required": false,
        "min_coverage_ratio": 0.6,
        "min_items": 1
      },
      "parameter-ranges": {
        "required": false,
        "min_coverage_ratio": 0.6,
        "min_items": 1
      }
    },
    "source_weights": {
      "kb_agent": 1.2,
      "verification_agent": 1.3
    },
    "topic_policy": {
      "allowlist": [
        "知识库",
        "证据",
        "参数"
      ],
      "blocklist": [
        "低价值重复"
      ]
    },
    "length_constraints": {
      "global_token_budget": 3000,
      "per_cluster_min_tokens": 72,
      "per_cluster_max_tokens": 420
    },
    "validation_policy": {
      "max_rewrite_rounds": 3,
      "require_entailment_check": true,
      "require_conflict_check": true
    }
  }
]
